"stage_id","derived_variable_id","display_name","s30b_status","representation_role","downstream_lane","consumer_exposure","formula","unit","frequency","coverage_start","coverage_end","source_input_ids","canonical_dataset_authorized","cross_family_join_authorized","distribution_capital_interaction_authorized","modeling_authorized","econometrics_authorized","notes"
"S30B_INCOME_DISTRIBUTION_FAMILY_CLOSURE","NFC_COMPENSATION_SHARE_GVA","NFC compensation share of gross value added","BASELINE_AUTHORIZED","preferred_unadjusted_wage_share","baseline_distribution_interface","value_bearing_consumer_interface","NFC_COMP / NFC_GVA","ratio","A",1929,2025,"NFC_COMP; NFC_GVA","no","no","no","no","no","S20C authorizes NFC_COMP / NFC_GVA as the preferred unadjusted wage-share baseline; S29A constructed that same direct ratio."
"S30B_INCOME_DISTRIBUTION_FAMILY_CLOSURE","NFC_COMPENSATION_SHARE_NVA","NFC compensation share of net value added","ROBUSTNESS_AUTHORIZED","net_value_added_wage_share_robustness","robustness_distribution_interface","value_bearing_consumer_interface","NFC_COMP / NFC_NVA","ratio","A",1929,2025,"NFC_COMP; NFC_NVA","no","no","no","no","no","S29A constructed direct compensation-share ratios; S30B preserves these as wage-share robustness variants below the NFC GVA baseline."
"S30B_INCOME_DISTRIBUTION_FAMILY_CLOSURE","NFC_NET_OPERATING_SURPLUS_SHARE_GVA","NFC net operating surplus share of gross value added","DIAGNOSTIC_ONLY","profit_related_complementary_share_diagnostic","diagnostic_distribution_catalog","reference_catalog_only","NFC_NOS / NFC_GVA","ratio","A",1929,2025,"NFC_NOS; NFC_GVA","no","no","no","no","no","S29A constructed net-operating-surplus shares; S20B/S20C keep profit-related shares as alternative or reconciliation evidence, not the preferred wage-share baseline."
"S30B_INCOME_DISTRIBUTION_FAMILY_CLOSURE","NFC_NET_OPERATING_SURPLUS_SHARE_NVA","NFC net operating surplus share of net value added","DIAGNOSTIC_ONLY","profit_related_complementary_share_diagnostic","diagnostic_distribution_catalog","reference_catalog_only","NFC_NOS / NFC_NVA","ratio","A",1929,2025,"NFC_NOS; NFC_NVA","no","no","no","no","no","S29A constructed net-operating-surplus shares; S20B/S20C keep profit-related shares as alternative or reconciliation evidence, not the preferred wage-share baseline."
"S30B_INCOME_DISTRIBUTION_FAMILY_CLOSURE","CORP_COMPENSATION_SHARE_GVA","Corporate compensation share of gross value added","ROBUSTNESS_AUTHORIZED","corporate_sector_wage_share_robustness","robustness_distribution_interface","value_bearing_consumer_interface","CORP_COMP / CORP_GVA","ratio","A",1929,2025,"CORP_COMP; CORP_GVA","no","no","no","no","no","S29A constructed direct compensation-share ratios; S30B preserves these as wage-share robustness variants below the NFC GVA baseline."
"S30B_INCOME_DISTRIBUTION_FAMILY_CLOSURE","CORP_COMPENSATION_SHARE_NVA","Corporate compensation share of net value added","ROBUSTNESS_AUTHORIZED","corporate_sector_net_value_added_wage_share_robustness","robustness_distribution_interface","value_bearing_consumer_interface","CORP_COMP / CORP_NVA","ratio","A",1929,2025,"CORP_COMP; CORP_NVA","no","no","no","no","no","S29A constructed direct compensation-share ratios; S30B preserves these as wage-share robustness variants below the NFC GVA baseline."
"S30B_INCOME_DISTRIBUTION_FAMILY_CLOSURE","CORP_NET_OPERATING_SURPLUS_SHARE_GVA","Corporate net operating surplus share of gross value added","DIAGNOSTIC_ONLY","profit_related_complementary_share_diagnostic","diagnostic_distribution_catalog","reference_catalog_only","CORP_NOS / CORP_GVA","ratio","A",1929,2025,"CORP_NOS; CORP_GVA","no","no","no","no","no","S29A constructed net-operating-surplus shares; S20B/S20C keep profit-related shares as alternative or reconciliation evidence, not the preferred wage-share baseline."
"S30B_INCOME_DISTRIBUTION_FAMILY_CLOSURE","CORP_NET_OPERATING_SURPLUS_SHARE_NVA","Corporate net operating surplus share of net value added","DIAGNOSTIC_ONLY","profit_related_complementary_share_diagnostic","diagnostic_distribution_catalog","reference_catalog_only","CORP_NOS / CORP_NVA","ratio","A",1929,2025,"CORP_NOS; CORP_NVA","no","no","no","no","no","S29A constructed net-operating-surplus shares; S20B/S20C keep profit-related shares as alternative or reconciliation evidence, not the preferred wage-share baseline."
