"variable_id","status","baseline_regressor","notes"
"q_omega","PARKED","no","q_omega remains parked and was not constructed."
"q_omega_family_columns","PARKED","no","No q_omega-family columns were created."
"D09_S_sensitivity_stocks","REPORT_ONLY_NOT_BASELINE","no","D09-S service-life sensitivity stocks remain report-only."
"total_capital","PARKED_EXCLUDED_FROM_BASELINE","no","Total capital is not baseline capital."
"total_fixed_assets","PARKED_EXCLUDED_FROM_BASELINE","no","Total fixed assets are not baseline capital."
"IPP","PARKED_EXCLUDED_FROM_BASELINE","no","IPP is not baseline capital."
"residential_capital","PARKED_EXCLUDED_FROM_BASELINE","no","Residential capital is not baseline capital."
"government_transportation","PARKED_EXCLUDED_FROM_BASELINE","no","Government transportation capital is not baseline capital."
"all_BEA_fixed_assets","PARKED_EXCLUDED_FROM_BASELINE","no","All-BEA fixed assets are not baseline capital."
