"spec_id","formula","menu_tier","standard_grid_status","estimator_refreeze_prep_status","reason"
"S35_CORE_MECH_COMP_OVB","y_t = alpha + beta k_Kcap + gamma Q_MEshare + delta omega_NFC + e_t","candidate_main_after_design_review","not_authorized_yet","hold","Theoretically leading, but k_Kcap and Q_MEshare remain highly collinear; omega_NFC is bounded-persistent OVB control."
"S35_MECH_COMP_PATH","y_t = alpha + beta k_Kcap + gamma Q_MEshare + e_t","candidate_nested_baseline_after_design_review","not_authorized_yet","hold","Cleaner theta-recovery path than OVB version, but still fails basic design fragility threshold."
"S35_DIST_ACCUM_PATH","y_t = alpha + beta k_Kcap + gamma Q_omega + e_t","reduced_form_robustness_only","diagnostic_or_robustness_only","do_not_refreeze_as_main","Q_omega is I(1) but nearly perfectly collinear with k_Kcap and is distribution-conditioned, not direct mechanization composition."
"S35_DIST_ACCUM_OVB","y_t = alpha + beta k_Kcap + gamma Q_omega + delta omega_NFC + e_t","reduced_form_robustness_only","diagnostic_only","do_not_refreeze_as_main","Adds bounded omega_NFC to a path already weighted by omega_NFC; double-counting risk plus near-singular design."
"S35_OBS_Q_PATH","y_t = alpha + beta k_Kcap + gamma Q_q + e_t","parked_observed_q_recovery","blocked_standard_grid","do_not_refreeze","Q_q remains I2_RISK; observed-q recovery is parked until a better q proxy is authorized."
"S35_RAW_K_OMEGA","y_t = alpha + beta k_Kcap + gamma (k_Kcap * omega_NFC) + e_t","blocked_raw_interaction","blocked_standard_grid","do_not_refreeze","Raw level interaction is blocked by S34."
"S35_RAW_K_Q","y_t = alpha + beta k_Kcap + gamma (k_Kcap * q_t) + e_t","blocked_raw_interaction","blocked_standard_grid","do_not_refreeze","Raw k*q is blocked by S34."
"S35_Q_SQUARED","a_t = lambda_0 + lambda_1 q_t + lambda_2 q_t^2 + e_t","cpr_polynomial_only","route_to_CPR","do_not_refreeze","Nonlinear mechanization through q^2 requires CPR/polynomial treatment."
"S35_Q_OMEGA_RAW","q_t = alpha + eta omega_NFC + e_t, or raw q_t * omega_NFC extension","upstream_diagnostic_only","diagnostic_only","do_not_refreeze_as_capacity_spec","Technique-choice screen is upstream and visually weak in S34."
